{
  "card": "a9e3c740",
  "contradictions": [
    {
      "description": "Span discovery-2 presents a debate where counsel argues for no fixed limit on requests for admissions, while the Bar Committee's proposal limits them to 30 unless stipulated or permitted by the court. The course's general instruction (discovery-4) lists 'Requests for Admissions' as one of five tools without specifying a numerical limit, creating a tension between the general tool list and the specific jurisdictional limit proposed in the hearing.",
      "human_review_required": true,
      "id": "contradiction-1",
      "resolution_state": "unresolved",
      "source_refs": [
        "discovery-2:L30-L57",
        "discovery-4:L34-L80"
      ]
    }
  ],
  "coverage": {
    "authorized_sources": 28,
    "contradiction_referenced_spans": 2,
    "contradiction_unreferenced_spans": [
      "discovery-1:L30-L76",
      "discovery-3:L34-L80",
      "elements-evidence-1:L34-L80",
      "elements-evidence-2:L34-L80",
      "elements-evidence-3:L34-L80",
      "motions-1:L30-L55",
      "motions-2:L34-L80",
      "planning-1:L30-L31",
      "planning-2:L34-L80",
      "planning-3:L34-L80",
      "planning-4:L34-L80",
      "planning-5:L30-L44",
      "planning-6:L34-L80",
      "planning-7:L34-L80",
      "planning-8:L34-L80",
      "pleadings-1:L30-L49",
      "pleadings-2:L34-L80",
      "pleadings-3:L34-L80",
      "post-judgment-1:L30-L34",
      "post-judgment-2:L30-L33",
      "post-judgment-3:L34-L80",
      "post-judgment-4:L34-L80",
      "trial-1:L30-L41",
      "trial-2:L34-L80",
      "trial-3:L34-L80",
      "trial-4:L34-L80"
    ],
    "covered_workflows": [
      "discovery",
      "elements-evidence",
      "motions",
      "planning",
      "pleadings",
      "post-judgment",
      "trial"
    ],
    "declared_spans": 28,
    "material_proposition_coverage_percent": 100,
    "material_propositions": 28,
    "proposition_referenced_spans": 28,
    "proposition_unreferenced_spans": [],
    "represented_sources": 28,
    "required_workflows": [
      "planning",
      "elements-evidence",
      "pleadings",
      "discovery",
      "motions",
      "trial",
      "post-judgment"
    ],
    "source_bound_material_propositions": 28,
    "unresolved_gap_referenced_spans": 28,
    "unresolved_gap_unreferenced_spans": []
  },
  "external_actions": {
    "dispatch": false,
    "filing": false,
    "mailing": false,
    "service": false,
    "workflow_state_advance": false
  },
  "jurisdiction_overlay": {
    "included": false,
    "rule": "No course proposition is controlling Authority or a Matter deadline.",
    "state": "unresolved"
  },
  "lanes": {
    "course_instruction": "source-derived proposals in this pack",
    "human_decision": "not supplied; review is required",
    "matter_facts_and_evidence": "not supplied",
    "model_inference": "Qwen proposal with per-item uncertainty",
    "official_authority": "not supplied; current jurisdiction-specific verification required"
  },
  "model_boundary": {
    "corpus_semantics": "sk-qwen",
    "corpus_served_model": "qwen3.8-27b-huihui-abliterated-q4_k_m",
    "fable_5_1_dispatchable": false,
    "fable_5_1_eligible": false,
    "fable_5_1_fallback": false,
    "fable_5_1_state": "placeholder_metadata_only",
    "frontier_available": "astra",
    "frontier_invoked": false,
    "protected_matter_egress": false
  },
  "propositions": [
    {
      "counter_support": "None",
      "human_review_required": true,
      "id": "prop-planning-1",
      "lane": "course_instruction",
      "source_refs": [
        "planning-1:L30-L31"
      ],
      "text": "The course concludes the introductory segment with a thank-you message to the viewer.",
      "uncertainty": "low",
      "workflow": "planning"
    },
    {
      "counter_support": "None",
      "human_review_required": true,
      "id": "prop-planning-2",
      "lane": "course_instruction",
      "source_refs": [
        "planning-2:L34-L80"
      ],
      "text": "The course defines 'Ab Initio' as meaning 'from the beginning' and notes its use in describing agreements unenforceable when first made, such as gambling debts.",
      "uncertainty": "low",
      "workflow": "planning"
    },
    {
      "counter_support": "None",
      "human_review_required": true,
      "id": "prop-planning-3",
      "lane": "course_instruction",
      "source_refs": [
        "planning-3:L34-L80"
      ],
      "text": "Maxims are defined as brief statements of self-evident truth that explain what is fair, right, and just, and are intended to control courts, legislatures, and societal considerations of fairness.",
      "uncertainty": "low",
      "workflow": "planning"
    },
    {
      "counter_support": "None",
      "human_review_required": true,
      "id": "prop-planning-4",
      "lane": "course_instruction",
      "source_refs": [
        "planning-4:L34-L80"
      ],
      "text": "The course introduces Natural Law by exploring the term 'Jurisprudence' to clarify the American heritage of law and the meaning of Natural Law without relying on sectarian or political opinions.",
      "uncertainty": "low",
      "workflow": "planning"
    },
    {
      "counter_support": "None",
      "human_review_required": true,
      "id": "prop-planning-5",
      "lane": "course_instruction",
      "source_refs": [
        "planning-5:L30-L44"
      ],
      "text": "Winning a lawsuit depends on having the facts and the law; confidence comes from knowing, and knowledge comes from truth. The course emphasizes that not every case is winnable and not every wrong has a remedy, using the abolished Florida cause of action for alienation of affections as an example of a removed remedy.",
      "uncertainty": "low",
      "workflow": "planning"
    },
    {
      "counter_support": "None",
      "human_review_required": true,
      "id": "prop-planning-6",
      "lane": "course_instruction",
      "source_refs": [
        "planning-6:L34-L80"
      ],
      "text": "The course advises users to view the 'Big Picture' before details, noting that while tactics work broadly, exact rule wording varies by jurisdiction, and users should consult official rules (e.g., Florida Rules of Evidence, California Rules of Civil Procedure) for their specific court.",
      "uncertainty": "low",
      "workflow": "planning"
    },
    {
      "counter_support": "None",
      "human_review_required": true,
      "id": "prop-planning-7",
      "lane": "course_instruction",
      "source_refs": [
        "planning-7:L34-L80"
      ],
      "text": "The course asserts that written words win court cases, countering the TV trope that cases are won at trial through last-minute witness questioning and new evidence.",
      "uncertainty": "low",
      "workflow": "planning"
    },
    {
      "counter_support": "None",
      "human_review_required": true,
      "id": "prop-planning-8",
      "lane": "course_instruction",
      "source_refs": [
        "planning-8:L34-L80"
      ],
      "text": "The course instructs users to plan before beginning, anticipating the opponent's actions and presenting facts and law to move the court, emphasizing that a good plan prevents being hampered throughout the lawsuit.",
      "uncertainty": "low",
      "workflow": "planning"
    },
    {
      "counter_support": "None",
      "human_review_required": true,
      "id": "prop-elements-evidence-1",
      "lane": "course_instruction",
      "source_refs": [
        "elements-evidence-1:L34-L80"
      ],
      "text": "The course presents contract law as the foundation of legal systems, using the biblical parable of the Vineyard Workers to illustrate the principle that 'a deal is a deal' and the importance of honoring agreements.",
      "uncertainty": "low",
      "workflow": "elements-evidence"
    },
    {
      "counter_support": "None",
      "human_review_required": true,
      "id": "prop-elements-evidence-2",
      "lane": "course_instruction",
      "source_refs": [
        "elements-evidence-2:L34-L80"
      ],
      "text": "The course provides a quiz and previews for evidence rules, objections, and winning tactics, positioning contract law as the foundation of all legal systems.",
      "uncertainty": "low",
      "workflow": "elements-evidence"
    },
    {
      "counter_support": "None",
      "human_review_required": true,
      "id": "prop-elements-evidence-3",
      "lane": "course_instruction",
      "source_refs": [
        "elements-evidence-3:L34-L80"
      ],
      "text": "The course describes evidence rules as a 'filter' that excludes falsified testimony, forged documents, and other inadmissible items from influencing the judge or jury.",
      "uncertainty": "low",
      "workflow": "elements-evidence"
    },
    {
      "counter_support": "None",
      "human_review_required": true,
      "id": "prop-pleadings-1",
      "lane": "course_instruction",
      "source_refs": [
        "pleadings-1:L30-L49"
      ],
      "text": "Pleadings frame the case; only what is alleged in the pleadings is decided at trial. The course explains that complaints must include jurisdictional allegations, factual allegations, and a wherefore clause, and that amendments are possible but subject to prejudice limits.",
      "uncertainty": "low",
      "workflow": "pleadings"
    },
    {
      "counter_support": "None",
      "human_review_required": true,
      "id": "prop-pleadings-2",
      "lane": "course_instruction",
      "source_refs": [
        "pleadings-2:L34-L80"
      ],
      "text": "An answer responds to each numbered paragraph of a complaint with 'Admitted', 'Denied', or 'Without sufficient knowledge to be able to respond', matching the paragraph numbers of the complaint.",
      "uncertainty": "low",
      "workflow": "pleadings"
    },
    {
      "counter_support": "None",
      "human_review_required": true,
      "id": "prop-pleadings-3",
      "lane": "course_instruction",